{"artifact_index":[{"content_hash":"a97089eaba09a90c8a4c8867a959087e42f343763665693a937716dbdf534d15","name":"decision.outputs","path":"artifacts/decision.outputs.v1.0.0.json","schema_version":"1.0.0","type":"decisions"},{"content_hash":"83514c55e939f4ae9c0964c688e916fb4fd48b396e092af0595992f1793a511c","name":"evaluation.metrics","path":"artifacts/evaluation.metrics.v1.0.0.json","schema_version":"1.0.0","type":"evaluation"},{"content_hash":"7f5ee08111655d7f74068229bf3d965aa251f24374958f5331a6a15369b65a11","name":"recommendation.outputs","path":"artifacts/recommendation.outputs.v1.0.0.json","schema_version":"1.0.0","type":"recommendation.outputs"},{"content_hash":"1dc1f9a7c4f30d96ef34e20cb88be5319c104e230d9dee204459ea6f705dc503","name":"execution.plan","path":"artifacts/execution.plan.v1.0.0.json","schema_version":"1.0.0","type":"execution.plan"},{"content_hash":"dfc811b5b8b90c8954f9442565b03d87c682c562a07758adcabe0a888ff6242b","name":"export.decision.outputs","path":"artifacts/exports/decision.outputs.parquet","schema_version":"1.0.0","type":"export.parquet"},{"content_hash":"9567b837d0524e6ead58a512e8e1c5bc54e6442af7481185391a399fc1bb980f","name":"export.evaluation.metrics","path":"artifacts/exports/evaluation.metrics.csv","schema_version":"1.0.0","type":"export.csv"},{"content_hash":"5313d1ac19adf5fbefccffebe44505e423e1d50e1e39c78f5f93e83be04cb6b7","name":"export.recommendation.outputs","path":"artifacts/exports/recommendation.outputs.csv","schema_version":"1.0.0","type":"export.csv"},{"content_hash":"0a28d87606e9d7c738a0f8dbbce81e38f4b9bb1910b37a9401deef8cbd7ae8c4","name":"export.execution.plan","path":"artifacts/exports/execution.plan.csv","schema_version":"1.0.0","type":"export.csv"},{"content_hash":"dfc811b5b8b90c8954f9442565b03d87c682c562a07758adcabe0a888ff6242b","name":"notebook.decision.outputs","path":"artifacts/notebook/decision.outputs.parquet","schema_version":"1.0.0","type":"notebook.parquet"},{"content_hash":"9567b837d0524e6ead58a512e8e1c5bc54e6442af7481185391a399fc1bb980f","name":"notebook.evaluation.metrics","path":"artifacts/notebook/evaluation.metrics.csv","schema_version":"1.0.0","type":"notebook.csv"},{"content_hash":"af1b27a9cf66626cfccd90e13cf70bf7964845bc9c2c3ec8fae7bdbe5bb27857","name":"execution.results","path":"artifacts/execution.results.v1.0.0.json","schema_version":"1.0.0","type":"execution.results"},{"name":"positions.snapshot.before","path":"artifacts/positions_snapshot_before.json","schema_version":"1.0.0","type":"positions.snapshot.before"},{"name":"positions.snapshot.after","path":"artifacts/positions_snapshot_after.json","schema_version":"1.0.0","type":"positions.snapshot.after"},{"content_hash":"d9105e90e559c5168c54fd9a49929c7086ad9783c9aa73ad7cacaf4cca9923e0","name":"export.execution.results","path":"artifacts/exports/execution.results.csv","schema_version":"1.0.0","type":"export.csv"},{"content_hash":"e622c49b24a2caf89616016a0982c6e877523f46dd3ea6897e95bda451633858","name":"paper.day_close","path":"artifacts/paper.day_close.v1.0.0.json","schema_version":"1.0.0","type":"paper.day_close"}],"config":{"snapshot_path":"/home/naguilar/projects/quant-trading-bot/src/backtest/config_backtest.json"},"data_snapshot_ids":{},"reader_min_version":"1.0.0","run_id":"20260422-1820","schema_version":"1.0.0","skips":[],"status":"SUCCESS","timestamps":{"completed_at":"2026-04-22T20:03:34.855889+00:00","created_at":"2026-04-22T20:03:34.838311+00:00","started_at":"2026-04-22T20:03:34.838341+00:00"}}