{"artifact_index":[{"content_hash":"8d4412c578a7e89f806b5f85f0ba9058575edb2b201d984fdd6d549163819f42","name":"decision.outputs","path":"artifacts/decision.outputs.v1.0.0.json","schema_version":"1.0.0","type":"decisions"},{"content_hash":"39642cb6276f89eac19e0086dcc1b1221072a0fb292642146ba0c321ce80ce08","name":"evaluation.metrics","path":"artifacts/evaluation.metrics.v1.0.0.json","schema_version":"1.0.0","type":"evaluation"},{"content_hash":"541dae89f99441019159a0beae1fea58409e6de92a863a7478830e77e9713c03","name":"export.decision.outputs","path":"artifacts/exports/decision.outputs.parquet","schema_version":"1.0.0","type":"export.parquet"},{"content_hash":"ca594cec338d10336276a1940ce780e966ccfd8496b9a9234d8592e62e417575","name":"export.evaluation.metrics","path":"artifacts/exports/evaluation.metrics.csv","schema_version":"1.0.0","type":"export.csv"},{"content_hash":"541dae89f99441019159a0beae1fea58409e6de92a863a7478830e77e9713c03","name":"notebook.decision.outputs","path":"artifacts/notebook/decision.outputs.parquet","schema_version":"1.0.0","type":"notebook.parquet"},{"content_hash":"ca594cec338d10336276a1940ce780e966ccfd8496b9a9234d8592e62e417575","name":"notebook.evaluation.metrics","path":"artifacts/notebook/evaluation.metrics.csv","schema_version":"1.0.0","type":"notebook.csv"},{"content_hash":"db7587a855b95e038f646579536be5f1de9fcaf012e8903dba0a70d8144f1c29","name":"recommendation.outputs","path":"artifacts/recommendation.outputs.v1.0.0.json","schema_version":"1.0.0","type":"recommendation.outputs"},{"content_hash":"830d53441858c46309960bc8107d11f97934c09018c5db8c47eb12caa11eccd7","name":"export.recommendation.outputs","path":"artifacts/exports/recommendation.outputs.csv","schema_version":"1.0.0","type":"export.csv"},{"content_hash":"131334747308c148083810006af7055b8fdcfa40d2466aa59da1b86338c4312e","name":"execution.plan","path":"artifacts/execution.plan.v1.0.0.json","schema_version":"1.0.0","type":"execution.plan"},{"content_hash":"f1cfb6d1a6ae0b32fb6e332ef70a43b309b03e49161977c1ed621970ecae431c","name":"export.execution.plan","path":"artifacts/exports/execution.plan.csv","schema_version":"1.0.0","type":"export.csv"},{"content_hash":"d4990785d12486e46f1d3e30c8edb0ca3830d3f5c9091ffc943456a3b27c4f04","name":"execution.results","path":"artifacts/execution.results.v1.0.0.json","schema_version":"1.0.0","type":"execution.results"},{"name":"positions.snapshot.after","path":"artifacts/positions_snapshot_after.json","schema_version":"1.0.0","type":"positions.snapshot.after"},{"content_hash":"6520fbc193edef0b49c3e338f30a8952cc36fcd79d0293bb72d151d925a63cea","name":"export.execution.results","path":"artifacts/exports/execution.results.csv","schema_version":"1.0.0","type":"export.csv"}],"config":{"snapshot_path":"/home/naguilar/projects/quant-trading-bot/src/backtest/config_backtest.json"},"data_snapshot_ids":{},"reader_min_version":"1.0.0","run_id":"20260119-1519","schema_version":"1.0.0","skips":[],"status":"SUCCESS","timestamps":{"completed_at":"2026-01-21T18:58:15.853990+00:00","created_at":"2026-01-21T18:58:15.852025+00:00","started_at":"2026-01-21T18:58:15.852131+00:00"}}