{"artifact_index":[{"content_hash":"caaffa6f08004bde84bc449de1797ed0e4b517c78a010174184ff546aee0bd07","name":"decision.outputs","path":"artifacts/decision.outputs.v1.0.0.json","schema_version":"1.0.0","type":"decisions"},{"content_hash":"c05e14a3c9202ef8021f3d3b535aba0a01ac505e6a9a58af03a23623748c6797","name":"evaluation.metrics","path":"artifacts/evaluation.metrics.v1.0.0.json","schema_version":"1.0.0","type":"evaluation"},{"content_hash":"c6c0bbc153a846134b319163c6fcd0a87eca6dcf57046ee5a813fb7a2c7c694d","name":"recommendation.outputs","path":"artifacts/recommendation.outputs.v1.0.0.json","schema_version":"1.0.0","type":"recommendation.outputs"},{"content_hash":"88114804981af81e85b294f5b7c82f8c70dc559fb3d27ecf27ca097381ec0c35","name":"execution.plan","path":"artifacts/execution.plan.v1.0.0.json","schema_version":"1.0.0","type":"execution.plan"},{"content_hash":"3df13ba9ab22c87f07502bfbe878235c21ca36565b0e01cbede109aef3decd45","name":"export.decision.outputs","path":"artifacts/exports/decision.outputs.parquet","schema_version":"1.0.0","type":"export.parquet"},{"content_hash":"7779cc132c4a261634e3dde40bb7029ce01e0f6b685ca51a90e67907c937b215","name":"export.evaluation.metrics","path":"artifacts/exports/evaluation.metrics.csv","schema_version":"1.0.0","type":"export.csv"},{"content_hash":"3cb77e6a7138ab38a4972e2658875e3065319b8b4bb33645b0fcd5374d4c87e3","name":"export.recommendation.outputs","path":"artifacts/exports/recommendation.outputs.csv","schema_version":"1.0.0","type":"export.csv"},{"content_hash":"2d276c640fd0776f5250d7be4a246423882fe5ce662d1984b4f1dfacdf886243","name":"export.execution.plan","path":"artifacts/exports/execution.plan.csv","schema_version":"1.0.0","type":"export.csv"},{"content_hash":"3df13ba9ab22c87f07502bfbe878235c21ca36565b0e01cbede109aef3decd45","name":"notebook.decision.outputs","path":"artifacts/notebook/decision.outputs.parquet","schema_version":"1.0.0","type":"notebook.parquet"},{"content_hash":"7779cc132c4a261634e3dde40bb7029ce01e0f6b685ca51a90e67907c937b215","name":"notebook.evaluation.metrics","path":"artifacts/notebook/evaluation.metrics.csv","schema_version":"1.0.0","type":"notebook.csv"},{"content_hash":"d5e0385b128a7a22a7cc1e83ab5a29f648f3d04fb933253c5acec074764b13d5","name":"execution.results","path":"artifacts/execution.results.v1.0.0.json","schema_version":"1.0.0","type":"execution.results"},{"name":"positions.snapshot.before","path":"artifacts/positions_snapshot_before.json","schema_version":"1.0.0","type":"positions.snapshot.before"},{"name":"positions.snapshot.after","path":"artifacts/positions_snapshot_after.json","schema_version":"1.0.0","type":"positions.snapshot.after"},{"content_hash":"d4295dc82f36b6556515d8f3f3889d593b404dff0fe786528d0ad1c0929ee103","name":"export.execution.results","path":"artifacts/exports/execution.results.csv","schema_version":"1.0.0","type":"export.csv"},{"content_hash":"32cefeea7fb135f1e76457e170449dba5edba627716da0cd9bb765d7d9645e95","name":"paper.day_close","path":"artifacts/paper.day_close.v1.0.0.json","schema_version":"1.0.0","type":"paper.day_close"}],"config":{"snapshot_path":"/home/naguilar/projects/quant-trading-bot/src/backtest/config_backtest.json"},"data_snapshot_ids":{},"reader_min_version":"1.0.0","run_id":"20260422-1910","schema_version":"1.0.0","skips":[],"status":"SUCCESS","timestamps":{"completed_at":"2026-04-23T19:12:34.743653+00:00","created_at":"2026-04-23T19:12:34.713590+00:00","started_at":"2026-04-23T19:12:34.713631+00:00"}}