{"artifact_index":[{"content_hash":"a63f4749d00d00d76e222f2fcca57b5895c681fe19ffbd862207b35aa2b52a72","name":"decision.outputs","path":"artifacts/decision.outputs.v1.0.0.json","schema_version":"1.0.0","type":"decisions"},{"content_hash":"108e2adf7a3c59315dfc1b03f239edf034fa2eeef2b5bc8eb076582dd8644a5d","name":"evaluation.metrics","path":"artifacts/evaluation.metrics.v1.0.0.json","schema_version":"1.0.0","type":"evaluation"},{"content_hash":"8403ca7a17bdf6b29f1a0e6dd3c2575c8130888601c56fb1936d820e872ff929","name":"recommendation.outputs","path":"artifacts/recommendation.outputs.v1.0.0.json","schema_version":"1.0.0","type":"recommendation.outputs"},{"content_hash":"32e5798117cdee58a13fa26a370f05fde8855163a57a04497a5d71023ee4901a","name":"execution.plan","path":"artifacts/execution.plan.v1.0.0.json","schema_version":"1.0.0","type":"execution.plan"},{"content_hash":"588ecc1977ebb1488d1b4570adb1a52dee296cdc561e3b2e6cfeced6da81a244","name":"export.decision.outputs","path":"artifacts/exports/decision.outputs.parquet","schema_version":"1.0.0","type":"export.parquet"},{"content_hash":"a196e2b8ec07af791e0355d431bd2f64131472ce28a9094a465a57f6502159f6","name":"export.evaluation.metrics","path":"artifacts/exports/evaluation.metrics.csv","schema_version":"1.0.0","type":"export.csv"},{"content_hash":"cfd8914568bb1e3d355a53ee4d6690e37b50ba3c8977a6687b911e659886f4b9","name":"export.recommendation.outputs","path":"artifacts/exports/recommendation.outputs.csv","schema_version":"1.0.0","type":"export.csv"},{"content_hash":"2d276c640fd0776f5250d7be4a246423882fe5ce662d1984b4f1dfacdf886243","name":"export.execution.plan","path":"artifacts/exports/execution.plan.csv","schema_version":"1.0.0","type":"export.csv"},{"content_hash":"588ecc1977ebb1488d1b4570adb1a52dee296cdc561e3b2e6cfeced6da81a244","name":"notebook.decision.outputs","path":"artifacts/notebook/decision.outputs.parquet","schema_version":"1.0.0","type":"notebook.parquet"},{"content_hash":"a196e2b8ec07af791e0355d431bd2f64131472ce28a9094a465a57f6502159f6","name":"notebook.evaluation.metrics","path":"artifacts/notebook/evaluation.metrics.csv","schema_version":"1.0.0","type":"notebook.csv"},{"content_hash":"d2445309bac87b54ea2625e9eed2c9e0c8c08b5a290a812c0bb644be22fc78e9","name":"execution.results","path":"artifacts/execution.results.v1.0.0.json","schema_version":"1.0.0","type":"execution.results"},{"name":"positions.snapshot.before","path":"artifacts/positions_snapshot_before.json","schema_version":"1.0.0","type":"positions.snapshot.before"},{"name":"positions.snapshot.after","path":"artifacts/positions_snapshot_after.json","schema_version":"1.0.0","type":"positions.snapshot.after"},{"content_hash":"d4295dc82f36b6556515d8f3f3889d593b404dff0fe786528d0ad1c0929ee103","name":"export.execution.results","path":"artifacts/exports/execution.results.csv","schema_version":"1.0.0","type":"export.csv"},{"content_hash":"2e0910859636c85b89fc5d9519da9bb653d819d7b4352c0579519384d85b0e50","name":"paper.day_close","path":"artifacts/paper.day_close.v1.0.0.json","schema_version":"1.0.0","type":"paper.day_close"}],"config":{"snapshot_path":"/home/naguilar/projects/quant-trading-bot/src/backtest/config_backtest.json"},"data_snapshot_ids":{},"reader_min_version":"1.0.0","run_id":"20260422-1940","schema_version":"1.0.0","skips":[],"status":"SUCCESS","timestamps":{"completed_at":"2026-04-23T20:49:30.088458+00:00","created_at":"2026-04-23T20:49:30.036500+00:00","started_at":"2026-04-23T20:49:30.036555+00:00"}}