{"artifact_index":[{"content_hash":"cd8a9713c7fb77f07ce0e33dcfa0da61e19f911d254d745ee36e1e45838015da","name":"decision.outputs","path":"artifacts/decision.outputs.v1.0.0.json","schema_version":"1.0.0","type":"decisions"},{"content_hash":"d5f083656f912c3f6fceb325d2a84d8c71cda6402e55f3161860dd9890e5b168","name":"evaluation.metrics","path":"artifacts/evaluation.metrics.v1.0.0.json","schema_version":"1.0.0","type":"evaluation"}],"config":{"snapshot_path":"/home/naguilar/projects/quant-trading-bot/src/backtest/config_backtest.json"},"data_snapshot_ids":{},"error":{"error_code":"FAILED","message":"artifact decision.outputs not found in manifest"},"reader_min_version":"1.0.0","run_id":"20260422-1815","schema_version":"1.0.0","skips":[],"status":"FAILED","timestamps":{"completed_at":"2026-04-22T19:54:12.899247+00:00","created_at":"2026-04-22T19:54:12.895004+00:00","started_at":"2026-04-22T19:54:12.895091+00:00"}}