{"artifact_index":[{"content_hash":"40e54c4574bb031b0435d123e25100ff5db622052eea537f2a522d0fcd731791","name":"decision.outputs","path":"artifacts/decision.outputs.v1.0.0.json","schema_version":"1.0.0","type":"decisions"},{"content_hash":"1b45cd9b4c0387611c54b03748796c348aa472f0bacbc270bf144ad87dbb7dc9","name":"evaluation.metrics","path":"artifacts/evaluation.metrics.v1.0.0.json","schema_version":"1.0.0","type":"evaluation"},{"content_hash":"004052ca297dff1ce6e0423230d734314bd83fef1dda8e5591bf655dd728d46a","name":"recommendation.outputs","path":"artifacts/recommendation.outputs.v1.0.0.json","schema_version":"1.0.0","type":"recommendation.outputs"},{"content_hash":"2ded115be9beebc393da006b755dc74a7ac82dddf00ec2075d5406b83f225447","name":"execution.plan","path":"artifacts/execution.plan.v1.0.0.json","schema_version":"1.0.0","type":"execution.plan"},{"content_hash":"43b22bdca154abd5563dc2a042cec8a4321281a5efa6029242281ae649098281","name":"export.decision.outputs","path":"artifacts/exports/decision.outputs.parquet","schema_version":"1.0.0","type":"export.parquet"},{"content_hash":"8997cf882b3dca34f1201960ab5543c8e19b7f8eb37ea48eb1807b733c3e578b","name":"export.evaluation.metrics","path":"artifacts/exports/evaluation.metrics.csv","schema_version":"1.0.0","type":"export.csv"},{"content_hash":"fc98718bb77fb3eac116175c1a6ec1fbf0f1c5b7224d9ae02a787c0d8b857d06","name":"export.recommendation.outputs","path":"artifacts/exports/recommendation.outputs.csv","schema_version":"1.0.0","type":"export.csv"},{"content_hash":"43b0b50b224a997246c8e45173250c11d93ba4699177394cd37bb4cb6554dbf4","name":"export.execution.plan","path":"artifacts/exports/execution.plan.csv","schema_version":"1.0.0","type":"export.csv"},{"content_hash":"43b22bdca154abd5563dc2a042cec8a4321281a5efa6029242281ae649098281","name":"notebook.decision.outputs","path":"artifacts/notebook/decision.outputs.parquet","schema_version":"1.0.0","type":"notebook.parquet"},{"content_hash":"8997cf882b3dca34f1201960ab5543c8e19b7f8eb37ea48eb1807b733c3e578b","name":"notebook.evaluation.metrics","path":"artifacts/notebook/evaluation.metrics.csv","schema_version":"1.0.0","type":"notebook.csv"}],"config":{"snapshot_path":"\\\\wsl.localhost\\Ubuntu\\home\\naguilar\\projects\\quant-trading-bot\\src\\backtest\\config_backtest.json"},"data_snapshot_ids":{},"reader_min_version":"1.0.0","run_id":"20260422-1825","schema_version":"1.0.0","skips":[],"status":"SUCCESS","timestamps":{"completed_at":"2026-04-22T20:12:04.816659+00:00","created_at":"2026-04-22T20:12:03.730290+00:00","started_at":"2026-04-22T20:12:03.730290+00:00"}}