{"artifact_index":[{"content_hash":"371eabdeef437ea92843453f41b2788fb6c67ffecfbfd8f651bbbd376415a6f0","name":"decision.outputs","path":"artifacts/decision.outputs.v1.0.0.json","schema_version":"1.0.0","type":"decisions"},{"content_hash":"12a0de7c6f5210f2b711e50c283344ee485dfd036ae1c97d1416c483167f76e1","name":"evaluation.metrics","path":"artifacts/evaluation.metrics.v1.0.0.json","schema_version":"1.0.0","type":"evaluation"},{"content_hash":"1e21fe5ab15298169a84fea52fa5e71ede6b9360c2ae5a1787b75b7a53011d62","name":"recommendation.outputs","path":"artifacts/recommendation.outputs.v1.0.0.json","schema_version":"1.0.0","type":"recommendation.outputs"},{"content_hash":"8bd02137180eb08758cc84f4b2b709ce891a80181f3ba253bc7b47aa4582bf82","name":"execution.plan","path":"artifacts/execution.plan.v1.0.0.json","schema_version":"1.0.0","type":"execution.plan"},{"content_hash":"947cfdea1a83bf5b8cbf0055c84b68730aa5551cc4a8cc169e3bab69286e4357","name":"export.decision.outputs","path":"artifacts/exports/decision.outputs.parquet","schema_version":"1.0.0","type":"export.parquet"},{"content_hash":"c389dac72eaefc730a9afe2b99831f9e9ea3413b0943903810307da4a8de38b9","name":"export.evaluation.metrics","path":"artifacts/exports/evaluation.metrics.csv","schema_version":"1.0.0","type":"export.csv"},{"content_hash":"468896ad79f82eba8712bb0fe0deb6739615e618d4a98076b76562c2ff4b5422","name":"export.recommendation.outputs","path":"artifacts/exports/recommendation.outputs.csv","schema_version":"1.0.0","type":"export.csv"},{"content_hash":"2d276c640fd0776f5250d7be4a246423882fe5ce662d1984b4f1dfacdf886243","name":"export.execution.plan","path":"artifacts/exports/execution.plan.csv","schema_version":"1.0.0","type":"export.csv"},{"content_hash":"947cfdea1a83bf5b8cbf0055c84b68730aa5551cc4a8cc169e3bab69286e4357","name":"notebook.decision.outputs","path":"artifacts/notebook/decision.outputs.parquet","schema_version":"1.0.0","type":"notebook.parquet"},{"content_hash":"c389dac72eaefc730a9afe2b99831f9e9ea3413b0943903810307da4a8de38b9","name":"notebook.evaluation.metrics","path":"artifacts/notebook/evaluation.metrics.csv","schema_version":"1.0.0","type":"notebook.csv"},{"content_hash":"c0ff5e71d1610db0df8e5160567180010c0ef929b79d81caf619c8121295bf9b","name":"execution.results","path":"artifacts/execution.results.v1.0.0.json","schema_version":"1.0.0","type":"execution.results"},{"name":"positions.snapshot.before","path":"artifacts/positions_snapshot_before.json","schema_version":"1.0.0","type":"positions.snapshot.before"},{"name":"positions.snapshot.after","path":"artifacts/positions_snapshot_after.json","schema_version":"1.0.0","type":"positions.snapshot.after"},{"content_hash":"d4295dc82f36b6556515d8f3f3889d593b404dff0fe786528d0ad1c0929ee103","name":"export.execution.results","path":"artifacts/exports/execution.results.csv","schema_version":"1.0.0","type":"export.csv"}],"config":{"snapshot_path":"/home/naguilar/projects/quant-trading-bot/src/backtest/config_backtest.json"},"data_snapshot_ids":{},"reader_min_version":"1.0.0","run_id":"20260422-1930","schema_version":"1.0.0","skips":[],"status":"SUCCESS","timestamps":{"completed_at":"2026-04-23T20:34:45.035508+00:00","created_at":"2026-04-23T20:34:45.020064+00:00","started_at":"2026-04-23T20:34:45.020096+00:00"}}