{"artifact_index":[{"content_hash":"3718ecf8f47aafd4b83c9c412057d4babc5741fe92fd148a8497aa34d1126959","name":"decision.outputs","path":"artifacts/decision.outputs.v1.0.0.json","schema_version":"1.0.0","type":"decisions"},{"content_hash":"7a037cfcec8ccf4efc9c351cebca366f989939ee91b7cff72cb839c1e0551439","name":"evaluation.metrics","path":"artifacts/evaluation.metrics.v1.0.0.json","schema_version":"1.0.0","type":"evaluation"},{"content_hash":"2b818b03de9da686e575546bba27428860aaa2cabcf5d8a60f51d18f1977f0a8","name":"recommendation.outputs","path":"artifacts/recommendation.outputs.v1.0.0.json","schema_version":"1.0.0","type":"recommendation.outputs"},{"content_hash":"b70f65425401c2c1d675781c372dc5ac54985660f16428e591cbde1b4cb675cc","name":"execution.plan","path":"artifacts/execution.plan.v1.0.0.json","schema_version":"1.0.0","type":"execution.plan"},{"content_hash":"fab5f0cd1694d0ad6da5f8be54c22b6992165070b35b1e06f7c1e4bea4f1b770","name":"export.decision.outputs","path":"artifacts/exports/decision.outputs.parquet","schema_version":"1.0.0","type":"export.parquet"},{"content_hash":"0d30ff1c76a55f8af8e56c8f399124db488b55cd0a2082e4180ef50ca30b5968","name":"export.evaluation.metrics","path":"artifacts/exports/evaluation.metrics.csv","schema_version":"1.0.0","type":"export.csv"},{"content_hash":"f67a4465b5f71226ec5cbc29046e1555cbdef5c00889b7dbe68393c12a0f88f1","name":"export.recommendation.outputs","path":"artifacts/exports/recommendation.outputs.csv","schema_version":"1.0.0","type":"export.csv"},{"content_hash":"4671f2376770d44aee099ebbb93428a2e302358826c1f20f45172364a5d6a2bb","name":"export.execution.plan","path":"artifacts/exports/execution.plan.csv","schema_version":"1.0.0","type":"export.csv"},{"content_hash":"fab5f0cd1694d0ad6da5f8be54c22b6992165070b35b1e06f7c1e4bea4f1b770","name":"notebook.decision.outputs","path":"artifacts/notebook/decision.outputs.parquet","schema_version":"1.0.0","type":"notebook.parquet"},{"content_hash":"0d30ff1c76a55f8af8e56c8f399124db488b55cd0a2082e4180ef50ca30b5968","name":"notebook.evaluation.metrics","path":"artifacts/notebook/evaluation.metrics.csv","schema_version":"1.0.0","type":"notebook.csv"}],"config":{"snapshot_path":"\\\\wsl.localhost\\Ubuntu\\home\\naguilar\\projects\\quant-trading-bot\\src\\backtest\\config_backtest.json"},"data_snapshot_ids":{},"reader_min_version":"1.0.0","run_id":"20260422-1835","schema_version":"1.0.0","skips":[],"status":"SUCCESS","timestamps":{"completed_at":"2026-04-22T20:40:28.267697+00:00","created_at":"2026-04-22T20:40:27.043033+00:00","started_at":"2026-04-22T20:40:27.043033+00:00"}}