{"artifact_index":[{"content_hash":"d5d8606b4ad221b3bce34a0c908b9750cb2896985b190619db379e90b25ae61b","name":"decision.outputs","path":"artifacts/decision.outputs.v1.0.0.json","schema_version":"1.0.0","type":"decisions"},{"content_hash":"c10034595f199f6878fea55bfe4c4bbbe824d951b632307e0885c4ac6e6c4ca5","name":"evaluation.metrics","path":"artifacts/evaluation.metrics.v1.0.0.json","schema_version":"1.0.0","type":"evaluation"},{"content_hash":"36d2bb147097e72bed16cf4f456ac5b09fc184aa9be30acca1a7835868ff4181","name":"recommendation.outputs","path":"artifacts/recommendation.outputs.v1.0.0.json","schema_version":"1.0.0","type":"recommendation.outputs"},{"content_hash":"1ff38487a840a21f9ad96f22ec110ba57fa7f8b6ac0de7df436c488fb16f18d7","name":"execution.plan","path":"artifacts/execution.plan.v1.0.0.json","schema_version":"1.0.0","type":"execution.plan"},{"content_hash":"7920a65b572a06be208bb418872f8be57b5afad166c93da3de49d2aa4cb7b1c4","name":"export.decision.outputs","path":"artifacts/exports/decision.outputs.parquet","schema_version":"1.0.0","type":"export.parquet"},{"content_hash":"8a7c0547672d08ffc22c697579ee05b89e38508ebfa8309d0c2b20bae44fce02","name":"export.evaluation.metrics","path":"artifacts/exports/evaluation.metrics.csv","schema_version":"1.0.0","type":"export.csv"},{"content_hash":"b48d83b6f883199764928f0d23e1aa13d4946413d06afacc080b35011c4b2c8e","name":"export.recommendation.outputs","path":"artifacts/exports/recommendation.outputs.csv","schema_version":"1.0.0","type":"export.csv"},{"content_hash":"44f6f647a327bfa09c95fc51f62c23558c3ea319f5cebe3b07a027d06acf9b29","name":"export.execution.plan","path":"artifacts/exports/execution.plan.csv","schema_version":"1.0.0","type":"export.csv"},{"content_hash":"7920a65b572a06be208bb418872f8be57b5afad166c93da3de49d2aa4cb7b1c4","name":"notebook.decision.outputs","path":"artifacts/notebook/decision.outputs.parquet","schema_version":"1.0.0","type":"notebook.parquet"},{"content_hash":"8a7c0547672d08ffc22c697579ee05b89e38508ebfa8309d0c2b20bae44fce02","name":"notebook.evaluation.metrics","path":"artifacts/notebook/evaluation.metrics.csv","schema_version":"1.0.0","type":"notebook.csv"},{"content_hash":"fa3aa5fca2ba1daf2aa9db070cb61dd2de0cc8cf50dbb6bb17594449f943c995","name":"execution.results","path":"artifacts/execution.results.v1.0.0.json","schema_version":"1.0.0","type":"execution.results"},{"name":"positions.snapshot.before","path":"artifacts/positions_snapshot_before.json","schema_version":"1.0.0","type":"positions.snapshot.before"},{"name":"positions.snapshot.after","path":"artifacts/positions_snapshot_after.json","schema_version":"1.0.0","type":"positions.snapshot.after"},{"content_hash":"557320c72fd61e14d5697d631fb20f8e308bae8a00d4ec49e46bb926f6a057d8","name":"export.execution.results","path":"artifacts/exports/execution.results.csv","schema_version":"1.0.0","type":"export.csv"},{"content_hash":"afb084e3688a3177d171db2ec5ee3cc490bb43142b3eea9964dabd7844ea3d62","name":"paper.day_close","path":"artifacts/paper.day_close.v1.0.0.json","schema_version":"1.0.0","type":"paper.day_close"}],"config":{"snapshot_path":"/home/naguilar/projects/quant-trading-bot/src/backtest/config_backtest.json"},"data_snapshot_ids":{},"reader_min_version":"1.0.0","run_id":"20260422-1800","schema_version":"1.0.0","skips":[],"status":"SUCCESS","timestamps":{"completed_at":"2026-04-22T19:10:34.774037+00:00","created_at":"2026-04-22T19:10:34.770443+00:00","started_at":"2026-04-22T19:10:34.770482+00:00"}}